{"type":"config","name":"Optimizing siftd ingest performance","metricName":"ingest_s","metricUnit":"s","bestDirection":"lower"}
{"run":1,"commit":"b59b901","metric":121.096,"metrics":{"conversations":6150},"status":"checks_failed","description":"Baseline: fresh ingest 121s, 6150 conversations. Checks script needs fix for numpy.","timestamp":1774058643606,"segment":0}
{"run":2,"commit":"b59b901","metric":114.459,"metrics":{"conversations":6150},"status":"checks_failed","description":"Baseline attempt 2: 114s. Still fixing checks script (numpy tests).","timestamp":1774058785268,"segment":0}
{"run":3,"commit":"b59b901","metric":117.194,"metrics":{"conversations":6150},"status":"checks_failed","description":"Baseline attempt 3: 117s. Fixing checks to use project test markers.","timestamp":1774058937719,"segment":0}
{"run":4,"commit":"382c732","metric":115.121,"metrics":{"conversations":6150},"status":"keep","description":"Baseline: fresh ingest 115s, 6150 conversations. All tests pass.","timestamp":1774059074591,"segment":0}
{"run":5,"commit":"e660c3c","metric":76.983,"metrics":{"conversations":6150},"status":"keep","description":"Cache workspace identity lookups during ingest to avoid repeated git subprocess calls (115s→77s, -33%)","timestamp":1774059533536,"segment":0}
{"run":11,"commit":"7624481","metric":53.25,"metrics":{"conversations":6150},"status":"keep","description":"Optimize binary filter (length check shortcut), blob storage (batch timestamp), import cleanup in insert_tool_call","timestamp":1774060876085,"segment":0}
{"run":14,"commit":"f7c4a5c","metric":48.355,"metrics":{"conversations":6150},"status":"keep","description":"Increase SQLite cache to 64MB and enable 256MB mmap for faster I/O (53s→48s)","timestamp":1774061588912,"segment":0}
{"run":15,"commit":"c465a01","metric":45.798,"metrics":{"conversations":6150},"status":"keep","description":"Use hashlib.file_digest() for faster file hashing (48s→46s)","timestamp":1774061730762,"segment":0}
{"run":16,"commit":"9be1853","metric":45.225,"metrics":{"conversations":6150},"status":"keep","description":"Add PRAGMA temp_store=MEMORY for faster temp table operations (46s→45s)","timestamp":1774061879241,"segment":0}
{"run":10,"commit":"60de341","metric":41.927,"metrics":{"conversations":6150},"status":"keep","description":"Fix lint (ULID semicolons), reset blob timestamp on new connection, prune ideas. Cleanup only — no perf change.","timestamp":1774063226517,"segment":0}
{"type":"config","name":"Storage layer test coverage efficiency","metricName":"efficiency","metricUnit":"","bestDirection":"lower"}
{"run":1,"commit":"f5c1ff9","metric":6.87,"metrics":{"coverage_pct":18.4,"test_time_s":2.854,"test_loc":532,"covered_lines":221},"status":"keep","description":"Baseline: 532 test LOC, 2.85s, 221/1201 lines covered (18.4%). Efficiency=6.87","timestamp":1774070767839,"segment":0}
{"run":2,"commit":"f7ccf01","metric":2.55,"metrics":{"coverage_pct":87.8,"test_time_s":2.018,"test_loc":1333,"covered_lines":1054},"status":"keep","description":"Add comprehensive storage tests: 90 tests covering store_conversation, vocabulary, FTS, filters, sessions, tags, queries, stats, tool_search. Fix xdist coverage issue. 18.4%→87.8% coverage, efficiency 6.87→2.55","timestamp":1774071049596,"segment":0}
{"run":3,"commit":"f7ccf01","metric":3.81,"metrics":{"coverage_pct":91.2,"test_time_s":2.795,"test_loc":1493,"covered_lines":1095},"status":"discard","description":"Add entity type tag tests, FTS edge cases, query edge cases, tool_search helpers. Coverage 87.8→91.2% but +160 LOC and slower tests made efficiency worse (2.55→3.81)","timestamp":1774071172607,"segment":0}
{"run":4,"commit":"1475670","metric":1.35,"metrics":{"coverage_pct":90.9,"test_time_s":1.751,"test_loc":842,"covered_lines":1092},"status":"keep","description":"Refactor test_blobs.py (715→264 LOC) with shared fixtures, consolidate test_storage.py imports to module level, compress tests. Same 130 tests, 90.9% coverage, efficiency 2.55→1.35","timestamp":1774071417246,"segment":0}
{"run":5,"commit":"9f5e093","metric":1.15,"metrics":{"coverage_pct":91.3,"test_time_s":1.485,"test_loc":852,"covered_lines":1096},"status":"keep","description":"Add fetch_last_ingest_time and no-filter exchanges tests. Coverage 90.9→91.3%, efficiency 1.35→1.15. +10 LOC for +4 covered lines.","timestamp":1774071504013,"segment":0}
{"run":6,"commit":"6324470","metric":1,"metrics":{"coverage_pct":91.3,"test_time_s":1.416,"test_loc":777,"covered_lines":1096},"status":"keep","description":"Merge test_blobs.py into test_storage.py, eliminating duplicate imports/fixtures/scaffold. 852→777 LOC, same 130 tests, 91.3% coverage. Efficiency 1.15→1.0","timestamp":1774071635787,"segment":0}
{"run":7,"commit":"6324470","metric":1.24,"metrics":{"coverage_pct":91.4,"test_time_s":1.738,"test_loc":785,"covered_lines":1098},"status":"discard","description":"Add FTS short token and filter join dependency tests. +8 LOC for +2 covered lines — not efficient enough (1.0→1.24, mostly timing noise)","timestamp":1774071720463,"segment":0}
{"run":8,"commit":"6d20f4e","metric":0.85,"metrics":{"coverage_pct":91.3,"test_time_s":1.269,"test_loc":738,"covered_lines":1096},"status":"keep","description":"Merge related tests into denser test methods (130→109 tests). 777→738 LOC, tests faster (fewer fixture setups). Efficiency 1.0→0.85","timestamp":1774071843784,"segment":0}
{"run":9,"commit":"ec0b59d","metric":0.66,"metrics":{"coverage_pct":91.3,"test_time_s":1.071,"test_loc":674,"covered_lines":1096},"status":"keep","description":"Aggressively merge test methods: WhereBuilder, queries, tags, sessions, db ops. 109→70 tests, 738→674 LOC, faster fixture setup (1.27→1.07s). Efficiency 0.85→0.66","timestamp":1774071970065,"segment":0}
{"run":10,"commit":"207f5bf","metric":0.48,"metrics":{"coverage_pct":91.3,"test_time_s":0.877,"test_loc":602,"covered_lines":1096},"status":"keep","description":"Continue merging: blob tests, tool call tests, file dedup tests, migration tests. 70→45 tests, 674→602 LOC, test time 1.07→0.88s. Efficiency 0.66→0.48","timestamp":1774072100984,"segment":0}
{"run":21,"commit":"00d4db8","metric":0.66,"metrics":{"coverage_pct":95.4,"test_time_s":0.834,"test_loc":908,"covered_lines":1146,"conversations":0},"status":"keep","description":"Add test_migrations.py: 12 tests covering schema version check, labels→tags, add_error, add_file_stat, add_branch, cascade_deletes, sessions last_seen_at, full migration path. Coverage 91.3→95.4% (+50 lines). Metric 0.48→0.66 (migration schemas are bulky but coverage gain is deliberate)","timestamp":1774072676769,"segment":1}
{"run":22,"commit":"c8e6788","metric":0.74,"metrics":{"coverage_pct":97,"test_time_s":0.922,"test_loc":930,"covered_lines":1165,"conversations":0},"status":"keep","description":"Add edge case tests: vocabulary cache-miss paths, FTS short-token/malformed query, transitive join deps, tag cache reload, display_name harness, record_ingested_file error, _normalize_tool_tokens. Coverage 95.4→97.0%, 6 modules at 100%. 36 lines remain (mostly dead code + git remote paths)","timestamp":1774072987369,"segment":1}
{"run":23,"commit":"1fafb4d","metric":0.54,"metrics":{"coverage_pct":97,"test_time_s":0.877,"test_loc":711,"covered_lines":1165,"conversations":0},"status":"keep","description":"Compress migration tests: generate legacy schema from schema.sql with _strip_cascade instead of hardcoded 80-line LEGACY_SCHEMA. Fix FTS ensure coverage (drop+recreate path). 930→711 LOC, 97.0% coverage (1165 lines), efficiency 0.74→0.54","timestamp":1774073248417,"segment":1}
{"run":24,"commit":"7e89000","metric":0.64,"metrics":{"coverage_pct":98,"test_time_s":1.056,"test_loc":714,"covered_lines":1177,"conversations":0},"status":"keep","description":"Cover get_or_create_tool with kwargs, ensure_tool_aliases skip path. Coverage 97.0→98.0% (1177/1201, 24 remaining). +3 LOC for +12 covered lines. Efficiency 0.54→0.64 (timing noise)","timestamp":1774073341795,"segment":1}
{"run":25,"commit":"b237967","metric":0.51,"metrics":{"coverage_pct":98.2,"test_time_s":0.832,"test_loc":728,"covered_lines":1179,"conversations":0},"status":"keep","description":"Cover cascade skip-missing-tables path, ensure_push_log_table. 98.2% coverage (1179/1201, 22 remaining). All easy-to-reach lines now covered. Efficiency 0.64→0.51","timestamp":1774073419749,"segment":1}
{"run":26,"commit":"f5ca8be","metric":0.5,"metrics":{"coverage_pct":98.2,"test_time_s":0.851,"test_loc":691,"covered_lines":1179,"conversations":0},"status":"keep","description":"Compress migration tests: merge label noop tests, merge column tests, shorten helpers. 728→691 LOC, same 98.2% coverage (1179/1201). Efficiency 0.51→0.50","timestamp":1774073587894,"segment":1}
{"type":"config","name":"Adapter layer test coverage efficiency","metricName":"efficiency","metricUnit":"","bestDirection":"lower"}
{"run":1,"commit":"c23d742","metric":0.77,"metrics":{"coverage_pct":60.3,"test_time_s":0.935,"test_loc":899,"covered_lines":1093},"status":"keep","description":"Baseline: 899 test LOC, 0.94s, 1093/1814 lines covered (60.3%). Efficiency=0.77","timestamp":1774075697275,"segment":1}
{"run":2,"commit":"a43a7a3","metric":0.52,"metrics":{"coverage_pct":74.5,"test_time_s":0.64,"test_loc":1100,"covered_lines":1351},"status":"keep","description":"Add SDK tests (open_external_db, discover_files, build_harness, timestamp_bounds, load_jsonl, ToolCallLinker, seek_last_lines, text helpers, peek_scan/exchanges/tail), registry tests, validation edge cases, discover functions for all adapters. Introduced _jsonl_file/_peek_session builders. Coverage 60.3→74.5%, efficiency 0.77→0.52","timestamp":1774076171016,"segment":1}
{"run":5,"commit":"7ccf85c","metric":0.49,"metrics":{"coverage_pct":86.8,"test_time_s":0.665,"test_loc":1171,"covered_lines":1574},"status":"keep","description":"Enrich codex peek fixture with usage/tool_call/multi-exchange data. Coverage 85.6→86.8% (+21 lines from codex peek_exchanges/peek_scan paths). Efficiency 0.53→0.49","timestamp":1774076423994,"segment":1}
{"run":6,"commit":"7ccf85c","metric":0.61,"metrics":{"coverage_pct":87.9,"test_time_s":0.8,"test_loc":1222,"covered_lines":1594},"status":"discard","description":"Refactor: replace hand-written JSON with builders (_claude_rec, _codex_meta/msg/tool/usage, _text_block, _tool_use_block, _write_jsonl). Coverage 86.8→87.9% (+20 lines from seek binary path, sessionId). Efficiency 0.49→0.61 (builders add LOC but enable future density)","timestamp":1774076676530,"segment":1}
{"run":7,"commit":"7ccf85c","metric":0.75,"metrics":{"coverage_pct":87.4,"test_time_s":1.06,"test_loc":1115,"covered_lines":1585},"status":"discard","description":"Refactor: move session builders (ClaudeSession, CodexSession, PeekSession, write_jsonl) to conftest.py as shared test infrastructure. Randomized data by default, builder pattern for customization. Coverage 86.8→87.4%, efficiency worse due to timing noise and builder overhead","timestamp":1774077044003,"segment":1}
{"run":8,"commit":"ca38107","metric":0.64,"metrics":{"coverage_pct":87.4,"test_time_s":0.913,"test_loc":1115,"covered_lines":1585},"status":"discard","description":"Baseline after builder refactor. 87.4% coverage, 1115 LOC, 0.91s. Builders in conftest enable dense future tests.","timestamp":1774077084239,"segment":1}
{"type":"config","name":"Adapter layer test coverage efficiency","metricName":"efficiency","metricUnit":"","bestDirection":"lower"}
{"run":5,"commit":"a78b1e8","metric":0.44,"metrics":{"coverage_pct":90.9,"test_time_s":1.325,"test_loc":520,"covered_lines":1565},"status":"keep","description":"Pure LOC compression: merge assertions, remove redundant imports, compress setup. 567→520 LOC, same 90.9% coverage","timestamp":1774133904032,"segment":2}
{"run":6,"commit":"2cd075e","metric":0.37,"metrics":{"coverage_pct":90.9,"test_time_s":1.145,"test_loc":511,"covered_lines":1565},"status":"keep","description":"More LOC compression: inline vars, compress records, convert lambdas to defs. 520→511 LOC, efficiency 0.44→0.37","timestamp":1774134017927,"segment":2}
{"type":"config","name":"Adapter layer test coverage efficiency (median-of-3 timing)","metricName":"efficiency","metricUnit":"","bestDirection":"lower"}
{"run":1,"commit":"83ec00e","metric":0.27,"metrics":{"coverage_pct":90.9,"test_time_s":0.849,"test_loc":502,"covered_lines":1565},"status":"keep","description":"Baseline with median-of-5 timing. 502 LOC, 90.9% coverage, ~0.85s median","timestamp":1774134539834,"segment":2}
{"run":2,"commit":"fb42237","metric":0.27,"metrics":{"coverage_pct":93.7,"test_time_s":0.836,"test_loc":526,"covered_lines":1612},"status":"keep","description":"Add copilot+pi normalizer tests. +24 LOC, +47 covered (90.9→93.7%), zero time impact. Efficiency holds at 0.27","timestamp":1774134608846,"segment":2}
{"run":5,"commit":"c67e629","metric":0.27,"metrics":{"coverage_pct":94.7,"test_time_s":0.724,"test_loc":604,"covered_lines":1629},"status":"keep","description":"Split monolith test_adapters.py → per-adapter files under tests/adapters/. Same efficiency, 94.7% coverage, clean structure for per-adapter optimization","timestamp":1774135344630,"segment":2}
{"run":6,"commit":"561ff2d","metric":0.36,"metrics":{"coverage_pct":94.7,"test_time_s":1.013,"test_loc":576,"covered_lines":1629},"status":"keep","description":"Deduplicate _fixture_source → conftest.fixture_source. 604→576 LOC (-28), same 94.7% coverage. Time variance elevated this run","timestamp":1774135521741,"segment":2}
{"run":7,"commit":"f0c82e3","metric":0.24,"metrics":{"coverage_pct":94.7,"test_time_s":0.68,"test_loc":574,"covered_lines":1629},"status":"keep","description":"Compress vscode + opencode tests, merge classes. 576→574 LOC, stable timing. Efficiency 0.36→0.24","timestamp":1774135649938,"segment":2}
{"type":"config","name":"Optimizing VSCode adapter test coverage efficiency","metricName":"efficiency","metricUnit":"","bestDirection":"lower"}
{"run":1,"commit":"cc1d648","metric":0.25,"metrics":{"coverage_pct":92.8,"test_time_s":0.546,"test_loc":84,"covered_lines":181},"status":"keep","description":"Baseline: vscode-only benchmark. 84 LOC, 92.8% coverage (181/195), 14 miss lines","timestamp":1774135787969,"segment":2}
{"run":2,"commit":"ad48bcc","metric":0.26,"metrics":{"coverage_pct":99.5,"test_time_s":0.449,"test_loc":111,"covered_lines":194},"status":"keep","description":"Cover 13 edge-case lines (discover, workspace paths, path helpers, replay edges). 92.8→99.5% coverage, efficiency 0.25→0.26 (edge zone: +6.7% coverage, only 4% regression). Only L124 (dead code) remains uncovered.","timestamp":1774136223902,"segment":2}
{"run":3,"commit":"ff06534","metric":0.25,"metrics":{"coverage_pct":100,"test_time_s":0.426,"test_loc":111,"covered_lines":193},"status":"keep","description":"Extract yield_conversation to SDK, remove dead guard from vscode/claude_code/aider/template. VSCode now 100% coverage (193/193), efficiency back to 0.25","timestamp":1774137636883,"segment":2}
{"type":"config","name":"Optimizing OpenCode adapter test coverage efficiency","metricName":"efficiency","metricUnit":"","bestDirection":"lower"}
{"run":1,"commit":"9970c28","metric":0.21,"metrics":{"coverage_pct":89.1,"test_time_s":0.411,"test_loc":78,"covered_lines":155},"status":"keep","description":"Baseline: opencode adapter. 78 LOC, 89.1% coverage (155/174), 19 miss lines, normal zone","timestamp":1774138299546,"segment":2}
{"run":2,"commit":"0f50879","metric":0.39,"metrics":{"coverage_pct":99.4,"test_time_s":0.538,"test_loc":124,"covered_lines":173},"status":"keep","description":"Cover 18 error-handling lines: corrupt DB, missing tables, bad JSON, pending tools, unknown parts. 89.1→99.4% coverage. Only L241 (tool→None by design) remains. Efficiency regressed due to DB setup LOC cost.","timestamp":1774138579762,"segment":2}
{"type":"config","name":"Optimizing Codex CLI adapter test coverage efficiency","metricName":"efficiency","metricUnit":"","bestDirection":"lower"}
{"run":2,"commit":"1c6aa8f","metric":0.21,"metrics":{"coverage_pct":100,"test_time_s":0.464,"test_loc":86,"covered_lines":194},"status":"discard","description":"Benchmark misconfigured — was measuring codex_cli not gemini_cli. Add default_location_source helper, apply to gemini/codex/copilot/pi_agent. Fix fts.py merge conflict.","timestamp":1774139741557,"segment":2}
{"run":3,"commit":"e687f29","metric":0.26,"metrics":{"coverage_pct":97.5,"test_time_s":0.543,"test_loc":74,"covered_lines":154},"status":"keep","description":"Add normalizer, discover, DEFAULT_LOCATIONS, peek_tail, thinking edge tests. 90.5→97.5% coverage. Only _resolve_project hash traversal (L254,259-261) remains uncovered.","timestamp":1774139817844,"segment":2}
{"type":"config","name":"Optimizing Claude Code adapter test coverage efficiency","metricName":"efficiency","metricUnit":"","bestDirection":"lower"}
{"run":1,"commit":"1e0d397","metric":0.14,"metrics":{"coverage_pct":93.2,"test_time_s":0.529,"test_loc":37,"covered_lines":137},"status":"keep","description":"Baseline: claude_code adapter. 37 LOC, 93.2% coverage (137/147), 10 miss lines, edge zone","timestamp":1774139963459,"segment":2}
{"run":2,"commit":"8382ed9","metric":0.24,"metrics":{"coverage_pct":99.3,"test_time_s":0.588,"test_loc":59,"covered_lines":146},"status":"keep","description":"Add normalizer edges (str/list/other content, tool_result, agentId), discover, empty parse, non-user/assistant skip. 93.2→99.3% coverage. Only L279 (_normalize_content fallback) remains.","timestamp":1774140230715,"segment":2}
{"run":3,"commit":"4d1ddbb","metric":0.19,"metrics":{"coverage_pct":99.3,"test_time_s":0.461,"test_loc":59,"covered_lines":146},"status":"keep","description":"Add wrapped.discover() and default dropin_path tests for registry (89→94%). Claude_code unchanged at 99.3%. Better timing this run.","timestamp":1774140429913,"segment":2}
{"type":"config","name":"Optimizing SDK test coverage efficiency","metricName":"efficiency","metricUnit":"","bestDirection":"lower"}
{"run":1,"commit":"b5d6e8a","metric":0.27,"metrics":{"coverage_pct":94.2,"test_time_s":0.555,"test_loc":152,"covered_lines":309},"status":"keep","description":"Baseline: sdk.py via test_infra.py. 152 LOC, 94.2% coverage (309/328), 19 miss lines, edge zone","timestamp":1774140601089,"segment":2}
{"run":2,"commit":"dbaefb0","metric":0.33,"metrics":{"coverage_pct":98.5,"test_time_s":0.577,"test_loc":187,"covered_lines":323},"status":"keep","description":"Cover 14 SDK lines: timestamp_bounds None, iter_jsonl blanks, peek_jsonl_tail bad JSON, tool hint whitespace, assistant-before-user scan, path-based subagent, tool-placeholder text, non-dict blocks, seek bad encoding. 94.2→98.5%.","timestamp":1774140931597,"segment":2}
{"type":"config","name":"Output layer test coverage (miss + efficiency)","metricName":"score","metricUnit":"","bestDirection":"lower"}
{"run":1,"commit":"2f8d009","metric":267.07,"metrics":{"miss":267,"coverage_pct":78.2,"test_time_s":0.322,"test_loc":201,"covered_lines":955,"efficiency":0.07},"status":"keep","description":"Baseline: output/ package. 201 test LOC, 78.2% coverage (955/1222), 267 miss. Score=267.07. Full-suite coverage measurement avoids redundant tests.","timestamp":1774143871745,"segment":9}
{"run":2,"commit":"9f1f405","metric":160.22,"metrics":{"miss":160,"coverage_pct":86.9,"test_time_s":0.395,"test_loc":579,"covered_lines":1062,"efficiency":0.22},"status":"keep","description":"Cover common.py (fmt_tokens/workspace/ago/model, truncate, refs_annotation, print_refs_content, print_indented), json/markdown/terminal render_search (all 3 modes), json render_detail fallback, markdown render_detail, MarkdownEmitter. 267→160 miss, 78→87% coverage.","timestamp":1774144487175,"segment":9}
{"run":3,"commit":"4e21f74","metric":52.04,"metrics":{"miss":51,"coverage_pct":95.8,"test_time_s":1.316,"test_loc":927,"covered_lines":1171,"efficiency":1.04},"status":"keep","description":"Add painted_bridge tests (emit_output, format_generic_input/result, render_narrative_block, render_query_detail_block, render_peek_detail_block, render_follow_event_block, render_peek_list_block), terminal render_detail, select_format, MarkdownEmitter edges. Switch to pytest --cov + single timing run. 267→51 miss, 78→96% coverage.","timestamp":1774145939078,"segment":9}
{"run":4,"commit":"cfd64a6","metric":21.63,"metrics":{"miss":21,"coverage_pct":98.3,"test_time_s":0.71,"test_loc":1068,"covered_lines":1201,"efficiency":0.63},"status":"keep","description":"Add tool presenter tests (shell raw fallback, overflow preview, file_read/edit/write/glob raw+error, search_grep raw, todo tasks), query detail with narrative, peek prompt-only + preview_unavailable, follow event no-content, json chunk file_refs+breakdown, terminal context_data response. 51→21 miss, 96→98% coverage.","timestamp":1774146409285,"segment":9}
{"run":5,"commit":"d7094a7","metric":17.54,"metrics":{"miss":17,"coverage_pct":98.6,"test_time_s":0.602,"test_loc":1076,"covered_lines":1205,"efficiency":0.54},"status":"keep","description":"Add json_fmt render_workspaces + render_tags tests, fix file_read raw input test. 21→17 miss, 98.3→98.6% coverage.","timestamp":1774146630292,"segment":9}
{"run":130,"commit":"f336544","metric":0,"metrics":{"conversations":0,"coverage_pct":0,"test_time_s":0,"test_loc":0,"covered_lines":0,"miss":0,"efficiency":0},"status":"crash","description":"Run failed immediately: autoresearch.sh points to stale output-only benchmark and exited on acceptance test failure. Reset benchmark config/workload before continuing.","timestamp":1774202360990,"segment":30}
{"type":"config","name":"sync transport coverage efficiency","metricName":"efficiency","metricUnit":"","bestDirection":"lower"}
{"run":1,"commit":"f336544","metric":0,"metrics":{},"status":"crash","description":"Baseline run failed: quoting bug in autoresearch.sh missing-lines parser caused Python SyntaxError before metrics emission.","timestamp":1774202562902,"segment":30}
