{"run":1,"commit":"0b7300f","metric":0.02,"metrics":{"covered_lines":424,"coverage_pct":100,"miss":0,"test_time_s":0.289,"test_loc":30},"status":"keep","description":"Pivoted from api/migrations to api/conversations lane. Updated benchmark/check targets to siftd.api.conversations + tests/test_api_conversations_edges.py, excluded newly added slow test_doctor_fix_shows_fix_commands from full-suite filter per user request, and added targeted tests for prompt-without-response turn construction and run_query_file non-SELECT empty-result branch. Baseline now 100% (424/424), miss 0, LOC 30, time 0.289s.","timestamp":1774235867589,"segment":30}
{"run":2,"commit":"0b7300f","metric":0.02,"metrics":{"covered_lines":424,"coverage_pct":100,"miss":0,"test_time_s":0.265,"test_loc":28},"status":"discard","description":"Step-down attempt on api/conversations edge lane merged two focused tests into one and reduced LOC 30→28, but rounded primary efficiency remained 0.02 at unchanged 100% coverage (424/424). Discard per stairstep rule (no primary improvement).","timestamp":1774236133310,"segment":30}
{"type":"config","name":"api-stats stepdown coverage efficiency","metricName":"efficiency","metricUnit":"","bestDirection":"lower"}
{"run":1,"commit":"4696b58","metric":0.07,"metrics":{"covered_lines":232,"coverage_pct":100,"miss":0,"test_time_s":0.277,"test_loc":55},"status":"keep","description":"Pivoted from saturated api/conversations floor lane to api/stats step-down follow-up. Updated benchmark/check targets to siftd.api.stats + tests/test_api_stats_edges.py and pruned ideas with conversation floor note. Baseline: 100% (232/232), miss 0, LOC 55, time 0.277s.","timestamp":1774236338771,"segment":30}
{"run":2,"commit":"2faedca","metric":0.05,"metrics":{"covered_lines":232,"coverage_pct":100,"miss":0,"test_time_s":0.284,"test_loc":39},"status":"keep","description":"Step down at equal api/stats coverage (232/232): compressed focused edge tests from 55→39 LOC by merging open/close + cache-cleanup checks and denser usage fixture setup/assertions, improving efficiency 0.07→0.05.","timestamp":1774236554708,"segment":30}
{"run":3,"commit":"2faedca","metric":0.06,"metrics":{"covered_lines":232,"coverage_pct":100,"miss":0,"test_time_s":0.32,"test_loc":42},"status":"discard","description":"Follow-up step-down attempt on api/stats edge tests regressed efficiency from 0.05→0.06 at unchanged 100% coverage (232/232) after alternate helper refactor; discard and revert.","timestamp":1774236801442,"segment":30}
{"type":"config","name":"api-merge coverage efficiency","metricName":"efficiency","metricUnit":"","bestDirection":"lower"}
{"run":1,"commit":"bacded9","metric":0.08,"metrics":{"covered_lines":134,"coverage_pct":100,"miss":0,"test_time_s":0.287,"test_loc":36},"status":"keep","description":"Pivoted from api-stats stepdown to api-merge lane. Updated benchmark/check targets to siftd.api.merge + tests/test_api_merge_edges.py, added focused foreign-key-violation rollback path test for merge_database, and pruned ideas to prioritize api/merge. Baseline now 100% (134/134), miss 0, LOC 36, time 0.287s.","timestamp":1774237467974,"segment":30}
{"run":2,"commit":"696a693","metric":0.05,"metrics":{"covered_lines":134,"coverage_pct":100,"miss":0,"test_time_s":0.304,"test_loc":23},"status":"keep","description":"Step down at equal api/merge coverage (134/134): compressed tests/test_api_merge_edges.py from 36→23 LOC by inlining lightweight cursor stubs and condensing no-op methods, preserving FK-violation rollback/close assertions.","timestamp":1774237649561,"segment":30}
{"type":"config","name":"api-slice coverage efficiency","metricName":"efficiency","metricUnit":"","bestDirection":"lower"}
{"run":1,"commit":"13657c5","metric":0.09,"metrics":{"covered_lines":70,"coverage_pct":100,"miss":0,"test_time_s":0.28,"test_loc":23},"status":"keep","description":"Pivoted from saturated api/merge to api/slice lane. Updated benchmark/check targets to siftd.api.slice + tests/test_api_slice_edges.py, added focused tests for missing source DB FileNotFound and _populate_slice foreign-key-violation guard error branch, and updated ideas to prioritize api/slice. Baseline now 100% (70/70), miss 0, LOC 23, time 0.28s.","timestamp":1774237912413,"segment":30}
{"run":2,"commit":"6d11d32","metric":0.07,"metrics":{"covered_lines":70,"coverage_pct":100,"miss":0,"test_time_s":0.285,"test_loc":17},"status":"keep","description":"Step down at equal api/slice coverage (70/70): compressed tests/test_api_slice_edges.py from 23→17 LOC by replacing dedicated result helper class with compact row-stub factory while preserving missing-source and FK-violation guard assertions.","timestamp":1774238091302,"segment":30}
{"type":"config","name":"api-export coverage efficiency","metricName":"efficiency","metricUnit":"","bestDirection":"lower"}
{"run":1,"commit":"1aa0216","metric":0.03,"metrics":{"covered_lines":66,"coverage_pct":100,"miss":0,"test_time_s":0.26,"test_loc":8},"status":"keep","description":"Pivoted from saturated api/slice lane to api/export. Updated benchmark/check targets to siftd.api.export + tests/test_api_export_edges.py, added focused test covering export_document fidelity=None default branch, and pruned ideas to promote api/export. Baseline now 100% (66/66), miss 0, LOC 8, time 0.26s.","timestamp":1774238463032,"segment":30}
{"run":2,"commit":"1aa0216","metric":0.03,"metrics":{"covered_lines":66,"coverage_pct":100,"miss":0,"test_time_s":0.273,"test_loc":7},"status":"discard","description":"Tried api/export step-down by collapsing assertions in tests/test_api_export_edges.py (LOC 8→7) at equal coverage 66/66. Efficiency remained flat at 0.03, so discarded per stairstep rule.","timestamp":1774238631992,"segment":30}
{"type":"config","name":"api-sessions coverage efficiency","metricName":"efficiency","metricUnit":"","bestDirection":"lower"}
{"run":1,"commit":"883e900","metric":0.41,"metrics":{"covered_lines":17,"coverage_pct":100,"miss":0,"test_time_s":0.27,"test_loc":26},"status":"keep","description":"Pivoted from api/export to api/sessions lane. Updated benchmark/check targets to siftd.api.sessions + tests/test_api_sessions_edges.py, added focused wrapper test for register_session argument forwarding (workspace_path + commit), and pruned ideas toward remaining tiny API misses. Baseline now 100% (17/17), miss 0, LOC 26, time 0.27s.","timestamp":1774238855423,"segment":30}
{"run":2,"commit":"b12c6ee","metric":0.17,"metrics":{"covered_lines":17,"coverage_pct":100,"miss":0,"test_time_s":0.282,"test_loc":10},"status":"keep","description":"Step down at equal api/sessions coverage (17/17): compressed tests/test_api_sessions_edges.py from 26→10 LOC using tuple capture for wrapper forwarding assertions while preserving commit/workspace propagation check.","timestamp":1774239018578,"segment":30}
{"type":"config","name":"api-adapters coverage efficiency","metricName":"efficiency","metricUnit":"","bestDirection":"lower"}
{"run":1,"commit":"aa942b5","metric":0.04,"metrics":{"covered_lines":29,"coverage_pct":96.7,"miss":1,"test_time_s":0.282,"test_loc":4},"status":"keep","description":"Pivoted from api/sessions to api/adapters lane. Updated benchmark/check targets to siftd.api.adapters + tests/test_api_adapters_edges.py and established baseline with one new focused test; current target coverage is 29/30 with remaining miss at entrypoint adapter append loop (L86).","timestamp":1774239226493,"segment":30}
{"run":2,"commit":"3cb78b7","metric":0.12,"metrics":{"covered_lines":30,"coverage_pct":100,"miss":0,"test_time_s":0.277,"test_loc":13},"status":"keep","description":"Step up api/adapters coverage from 29→30 lines by adding entrypoint-adapter loop test in tests/test_api_adapters_edges.py (mocked builtin/dropin empty and entrypoint non-empty). Closed final miss L86; target now 100% (30/30).","timestamp":1774239394848,"segment":30}
{"run":3,"commit":"861fd98","metric":0.11,"metrics":{"covered_lines":30,"coverage_pct":100,"miss":0,"test_time_s":0.375,"test_loc":9},"status":"keep","description":"Step down at equal api/adapters coverage (30/30): removed redundant builtin-key assertion test and kept only entrypoint-loop coverage test, reducing LOC 13→9 while preserving full coverage.","timestamp":1774239561389,"segment":30}
{"type":"config","name":"api-init coverage efficiency","metricName":"efficiency","metricUnit":"","bestDirection":"lower"}
{"run":1,"commit":"5f5700d","metric":0.05,"metrics":{"covered_lines":25,"coverage_pct":100,"miss":0,"test_time_s":0.269,"test_loc":5},"status":"keep","description":"Pivoted from api/adapters to api/__init__ lane. Updated benchmark/check targets to --cov=siftd.api with TARGET_FILE src/siftd/api/__init__.py and added focused unknown-symbol __getattr__ AttributeError test in tests/test_api_init_edges.py. Baseline now 100% (25/25), miss 0, LOC 5, time 0.269s.","timestamp":1774239759050,"segment":30}
{"type":"config","name":"adapters-jsonl coverage efficiency","metricName":"efficiency","metricUnit":"","bestDirection":"lower"}
{"run":1,"commit":"32fe4a6","metric":0.06,"metrics":{"covered_lines":21,"coverage_pct":100,"miss":0,"test_time_s":0.27,"test_loc":5},"status":"keep","description":"Pivoted from api/__init__ to adapters._jsonl lane. Updated benchmark/check targets to siftd.adapters._jsonl + tests/adapters/test_jsonl_edges.py, added focused parse_block string-input fast-path test, and pruned ideas to adapter residuals. Baseline now 100% (21/21), miss 0, LOC 5, time 0.27s.","timestamp":1774240011090,"segment":30}
{"type":"config","name":"adapters-registry coverage efficiency","metricName":"efficiency","metricUnit":"","bestDirection":"lower"}
{"run":1,"commit":"4aed43c","metric":0.09,"metrics":{"covered_lines":35,"coverage_pct":100,"miss":0,"test_time_s":0.269,"test_loc":12},"status":"keep","description":"Pivoted from adapters._jsonl to adapters.registry lane. Updated benchmark/check targets to siftd.adapters.registry + tests/adapters/test_registry_edges.py and added focused test covering adapter path override branch in load_all_adapters (configured locations -> wrap_adapter_paths). Baseline now 100% (35/35), miss 0, LOC 12, time 0.269s.","timestamp":1774240193498,"segment":30}
{"run":2,"commit":"b6e70db","metric":0.08,"metrics":{"covered_lines":35,"coverage_pct":100,"miss":0,"test_time_s":0.297,"test_loc":10},"status":"keep","description":"Step down at equal adapters.registry coverage (35/35): compacted tests/adapters/test_registry_edges.py from 12→10 LOC by inlining result assertion and removing redundant equality check while preserving path-override branch coverage.","timestamp":1774240375619,"segment":30}
{"type":"config","name":"model-names coverage efficiency","metricName":"efficiency","metricUnit":"","bestDirection":"lower"}
{"run":1,"commit":"b2db3ae","metric":0.07,"metrics":{"covered_lines":41,"coverage_pct":100,"miss":0,"test_time_s":0.26,"test_loc":11},"status":"keep","description":"Pivoted from adapters.registry to model_names lane. Updated benchmark/check targets to siftd.model_names + tests/test_model_names_edges.py and added focused test for _parse_gemini unknown-variant fallback branch. Baseline now 100% (41/41), miss 0, LOC 11, time 0.26s.","timestamp":1774240580643,"segment":30}
{"run":2,"commit":"d175965","metric":0.03,"metrics":{"covered_lines":41,"coverage_pct":100,"miss":0,"test_time_s":0.267,"test_loc":5},"status":"keep","description":"Step down at equal model_names coverage (41/41): compressed tests/test_model_names_edges.py from 11→5 LOC by asserting fallback structure via key checks/comprehension while preserving unknown gemini variant behavior coverage.","timestamp":1774240766320,"segment":30}
{"type":"config","name":"adapters-aider coverage efficiency","metricName":"efficiency","metricUnit":"","bestDirection":"lower"}
{"run":1,"commit":"d72431b","metric":0.02,"metrics":{"covered_lines":155,"coverage_pct":99.4,"miss":1,"test_time_s":0.274,"test_loc":10},"status":"keep","description":"Pivoted from model_names to adapters.aider lane. Updated benchmark/check targets to siftd.adapters.aider + tests/adapters/test_aider_edges.py and added focused analytics.jsonl location-matching test. Baseline at 155/156 (99.4%) with one remaining miss at line 89 in DEFAULT_LOCATIONS loop.","timestamp":1774240968768,"segment":30}
{"run":2,"commit":"cc69fd0","metric":0.03,"metrics":{"covered_lines":156,"coverage_pct":100,"miss":0,"test_time_s":0.393,"test_loc":10},"status":"keep","description":"Step up adapters.aider coverage from 155→156 by making DEFAULT_LOCATIONS match deterministic against lowercased path in edge test, exercising the location-loop positive return branch (L89). Target now 100% (156/156).","timestamp":1774241158591,"segment":30}
{"run":3,"commit":"cc69fd0","metric":0.02,"metrics":{"covered_lines":156,"coverage_pct":100,"miss":0,"test_time_s":0.386,"test_loc":8},"status":"discard","description":"Attempted adapters.aider step-down by compressing tests/adapters/test_aider_edges.py LOC 10→8 at equal 156/156 coverage. Rounded efficiency stayed flat at 0.02, so discarded per stairstep rule.","timestamp":1774241370792,"segment":30}
{"type":"config","name":"adapters-claude-code coverage efficiency","metricName":"efficiency","metricUnit":"","bestDirection":"lower"}
{"run":1,"commit":"e7ad4cf","metric":0.01,"metrics":{"covered_lines":147,"coverage_pct":100,"miss":0,"test_time_s":0.394,"test_loc":3},"status":"keep","description":"Pivoted from adapters.aider to adapters.claude_code lane. Updated benchmark/check targets to siftd.adapters.claude_code + tests/adapters/test_claude_code_edges.py and added focused _normalize_content unknown-type fallback test. Baseline now 100% (147/147), miss 0, LOC 3, time 0.394s.","timestamp":1774241611541,"segment":30}
{"type":"config","name":"adapters-opencode coverage efficiency","metricName":"efficiency","metricUnit":"","bestDirection":"lower"}
{"run":1,"commit":"ee6642b","metric":0.01,"metrics":{"covered_lines":174,"coverage_pct":100,"miss":0,"test_time_s":0.377,"test_loc":3},"status":"keep","description":"Pivoted from adapters.claude_code to adapters.opencode lane. Updated benchmark/check targets to siftd.adapters.opencode + tests/adapters/test_opencode_edges.py and added focused _part_to_content_block tool-type skip branch test. Baseline now 100% (174/174), miss 0, LOC 3, time 0.377s.","timestamp":1774241847689,"segment":30}
{"type":"config","name":"adapters-pi-agent coverage efficiency","metricName":"efficiency","metricUnit":"","bestDirection":"lower"}
{"run":1,"commit":"ee6642b","metric":0,"metrics":{"covered_lines":154,"coverage_pct":100,"miss":0,"test_time_s":0.398,"test_loc":14},"status":"crash","description":"Pivoted to adapters.pi_agent lane with focused edge tests, but run_experiment timed out despite benchmark emitting metrics (154/154, eff 0.04). Treating as crash per timeout policy; will rerun baseline from reverted state.","timestamp":1774272597212,"segment":30}
{"run":2,"commit":"13c35d3","metric":0.04,"metrics":{"covered_lines":154,"coverage_pct":100,"miss":0,"test_time_s":0.385,"test_loc":14},"status":"keep","description":"Reran adapters.pi_agent baseline after prior timeout anomaly (using explicit checks timeout). Focused lane with tests/adapters/test_pi_agent_edges.py now completes cleanly: 100% (154/154), miss 0, LOC 14, time 0.385s.","timestamp":1774272821240,"segment":30}
{"run":3,"commit":"a0434d6","metric":0.02,"metrics":{"covered_lines":154,"coverage_pct":100,"miss":0,"test_time_s":0.244,"test_loc":13},"status":"keep","description":"Step down at equal adapters.pi_agent coverage (154/154): compacted tests/adapters/test_pi_agent_edges.py (LOC 14→13) by inlining mocked load_jsonl fixture setup, preserving non-jsonl rejection and started_at fallback branch checks. Efficiency improved 0.04→0.02.","timestamp":1774272985448,"segment":30}
{"type":"config","name":"adapters-sdk coverage efficiency","metricName":"efficiency","metricUnit":"","bestDirection":"lower"}
{"run":1,"commit":"cb2f20d","metric":0.01,"metrics":{"covered_lines":328,"coverage_pct":100,"miss":0,"test_time_s":0.27,"test_loc":12},"status":"keep","description":"Pivoted from adapters.pi_agent to adapters.sdk lane. Updated benchmark/check targets to siftd.adapters.sdk + tests/adapters/test_sdk_edges.py and added focused seek_last_lines OSError branch test for binary open failure path. Baseline now 100% (328/328), miss 0, LOC 12, time 0.27s.","timestamp":1774273239570,"segment":30}
{"type":"config","name":"tool-query coverage efficiency","metricName":"efficiency","metricUnit":"","bestDirection":"lower"}
{"run":1,"commit":"8299252","metric":0.01,"metrics":{"covered_lines":80,"coverage_pct":100,"miss":0,"test_time_s":0.28,"test_loc":3},"status":"keep","description":"Pivoted from adapters.sdk to tool_query lane. Updated benchmark/check targets to siftd.tool_query + tests/test_tool_query_edges.py and added focused ToolQueryTerm.is_fielded property test. Baseline now 100% (80/80), miss 0, LOC 3, time 0.28s.","timestamp":1774273603430,"segment":30}
{"type":"config","name":"peek-reader coverage efficiency","metricName":"efficiency","metricUnit":"","bestDirection":"lower"}
{"run":1,"commit":"c065dca","metric":0.04,"metrics":{"covered_lines":162,"coverage_pct":100,"miss":0,"test_time_s":0.29,"test_loc":20},"status":"keep","description":"Pivoted from tool_query to peek.reader lane. Updated benchmark/check targets to siftd.peek.reader + tests/test_reader_edges.py, added focused test that invokes derived _resolve_peek_scan wrapper and verifies SDK peek_scan_from_records call wiring. Baseline now 100% (162/162), miss 0, LOC 20, time 0.29s.","timestamp":1774273880952,"segment":30}
{"run":2,"commit":"f723706","metric":0.02,"metrics":{"covered_lines":162,"coverage_pct":100,"miss":0,"test_time_s":0.272,"test_loc":12},"status":"keep","description":"Step down at equal peek.reader coverage (162/162): compressed tests/test_reader_edges.py from 20→12 LOC by returning tuple from peek_scan_from_records stub and asserting full tuple directly, preserving derived-wrapper wiring checks.","timestamp":1774274068650,"segment":30}
{"type":"config","name":"doctor-freelist coverage efficiency","metricName":"efficiency","metricUnit":"","bestDirection":"lower"}
{"run":1,"commit":"cc41a21","metric":0.16,"metrics":{"covered_lines":19,"coverage_pct":100,"miss":0,"test_time_s":0.279,"test_loc":11},"status":"keep","description":"Pivoted from peek.reader to doctor/checks/freelist lane. Updated benchmark/check targets to siftd.doctor.checks.freelist + tests/test_doctor_freelist_edges.py and added focused MB-format branch test for large freelist waste in FreelistCheck.run. Baseline now 100% (19/19), miss 0, LOC 11, time 0.279s.","timestamp":1774274372565,"segment":30}
{"run":2,"commit":"624cd69","metric":0.13,"metrics":{"covered_lines":19,"coverage_pct":100,"miss":0,"test_time_s":0.401,"test_loc":6},"status":"keep","description":"Step down at equal doctor/freelist coverage (19/19): compressed tests/test_doctor_freelist_edges.py from 11→6 LOC by inlining monkeypatch/context setup and consolidating assertions while preserving MB-format and wasted_bytes checks.","timestamp":1774274664533,"segment":30}
{"type":"config","name":"serve-client coverage efficiency","metricName":"efficiency","metricUnit":"","bestDirection":"lower"}
{"run":1,"commit":"a5a622d","metric":0.35,"metrics":{"covered_lines":71,"coverage_pct":87.7,"miss":10,"test_time_s":0.381,"test_loc":66},"status":"keep","description":"Pivoted from non-serve saturation into serve module. Retargeted benchmark/check scripts to siftd.serve.client with tests/test_serve_client.py + new tests/test_serve_client_edges.py, removed 'not serve' filter from benchmark/check suite runs, and added deterministic edge coverage for parse/default URL/connection selection/HTTP+JSON failure paths and probe health guard. Baseline: 71/81 (87.7%), miss 10, LOC 66, time 0.381s.","timestamp":1774275839062,"segment":30}
{"run":2,"commit":"f354bb6","metric":0.45,"metrics":{"covered_lines":81,"coverage_pct":100,"miss":0,"test_time_s":0.375,"test_loc":97},"status":"keep","description":"Step up serve.client coverage from 71→81 by expanding edge tests for _get_json query-path + non-dict validation, _post_json non-200 + invalid-json errors, probe_health success payload, and search/stats wrapper forwarding. Lane now 100% (81/81), miss 0.","timestamp":1774276127724,"segment":30}
{"type":"config","name":"serve-delegation coverage efficiency","metricName":"efficiency","metricUnit":"","bestDirection":"lower"}
{"run":1,"commit":"a074c29","metric":0.55,"metrics":{"covered_lines":108,"coverage_pct":83.1,"miss":22,"test_time_s":0.372,"test_loc":161},"status":"keep","description":"Pivoted to serve.delegation lane (serve-enabled benchmark/check filters retained). Updated benchmark/check targets to siftd.serve.delegation with tests/test_serve_delegation.py + new tests/test_serve_delegation_edges.py and established baseline at 108/130 (83.1%) with 22 misses.","timestamp":1774276633007,"segment":30}
{"run":2,"commit":"a95ea55","metric":0.59,"metrics":{"covered_lines":128,"coverage_pct":98.5,"miss":2,"test_time_s":0.356,"test_loc":213},"status":"keep","description":"Step up serve.delegation coverage from 108→128 lines by adding focused edge tests for parser/import fallback branches, non-loopback auto-discovery guard, try_delegate success + health/db-shape/error guards, and try_delegate_post early-return/mismatch/exception paths. Remaining misses now only resolve_serve_url invalid serve.port parse fallback (L88-89).","timestamp":1774276919123,"segment":30}
{"run":3,"commit":"7d11776","metric":0.59,"metrics":{"covered_lines":130,"coverage_pct":100,"miss":0,"test_time_s":0.35,"test_loc":220},"status":"keep","description":"Closed final serve.delegation misses (L88-89) with invalid serve.port parse fallback test in resolve_serve_url. Target now 100% (130/130) with full delegation edge matrix covered.","timestamp":1774277125642,"segment":30}
